conversation_id_str,created_at,favorite_count,full_text,id_str,image_url,in_reply_to_screen_name,lang,location,quote_count,reply_count,retweet_count,tweet_url,user_id_str,username
1961344567208493206,Fri Aug 29 08:25:59 +0000 2025,370,Badan Eksekutif Mahasiswa Universitas Indonesia (BEM UI) akan menggelar unjuk rasa di Polda Metro Jaya. Massa mahasiswa berangkat menggunakan bus dari kampus UI Depok Jawa Barat. &gt;&gt; https://t.co/9m03rpxXPp https://t.co/6HTPrgjESL,1961344567208493206,https://pbs.twimg.com/amplify_video_thumb/1961344201104515074/img/VZ6HVU6WPfKOwB22.jpg,,in,,5,5,89,https://x.com/undefined/status/1961344567208493206,69183155,
1960974052895686836,Thu Aug 28 07:53:42 +0000 2025,678,14.47 #LiputanSonora Aksi demo ratusan Mahasiswa di depan DPR terus berdatangan setelah sebelumnya aksi demo dilakukan oleh ribuan kelompok buruh. Saat ini pendemo tampak membakar seperti botol didepan pagar DPR. Via @bram92 https://t.co/bgdkI1fxNW,1960974052895686836,https://pbs.twimg.com/ext_tw_video_thumb/1960974023850110976/pu/img/4XTOViA8OWf2ua0q.jpg,,in,,17,20,294,https://x.com/undefined/status/1960974052895686836,180696019,
1962029525052936237,Sun Aug 31 05:47:46 +0000 2025,333,bisa teman-teman lihat semuanya pada tanggal 29 agustus 2025 kami melaksanakan aksi demo di depan gedung dprd provinsi bengkulu. pada saat ini massa sedang tenang dan TIDAK MELAKUKAN KEANARKISAN APAPUN. tapi apa? kami masih ditembaki gas air mata! sc tertera. https://t.co/QGDfg4Fyzv,1962029525052936237,https://pbs.twimg.com/ext_tw_video_thumb/1962029281552535552/pu/img/aQZ0nGuLPjIHXf9x.jpg,,in,,6,3,172,https://x.com/undefined/status/1962029525052936237,1806599704165388288,
1961786976727933401,Sat Aug 30 13:43:58 +0000 2025,212,Aksi unjuk rasa juga terjadi di Cirebon Surabaya dan Yogyakarta Sabtu (30/08). Di Cirebon dan Yogyakarta demonstrasi berujung ricuh. Sementara di Surabaya mahasiswa berunjuk rasa menuntut pembebasan kawan-kawan mereka yang ditangkap aparat. https://t.co/gD3shyxj3x,1961786976727933401,https://pbs.twimg.com/amplify_video_thumb/1961786062768140288/img/RAmySmZE7xzeA1Pq.jpg,,in,,0,9,78,https://x.com/undefined/status/1961786976727933401,23772644,
1961852903733572045,Sat Aug 30 18:05:56 +0000 2025,3118,Suasana info terkini Mako Brimob Kwitang Jakarta Pusat. Masih dipenuhi massa aksi unjuk rasa. Stay safe dan hati-hati rekan semua yg berada sekitar area ini dimulai dari daerah Tugu Tani. https://t.co/qnjgUtNDxA,1961852903733572045,https://pbs.twimg.com/ext_tw_video_thumb/1961852858107924480/pu/img/bSeblj57iCN220r2.jpg,,in,,4,20,791,https://x.com/undefined/status/1961852903733572045,1628338800362672128,
1961797374847902047,Sat Aug 30 14:25:17 +0000 2025,154,First of all demonstran itu NGGAK anarkis ya. Yang bikin ada kekerasan dan chaos itu provokator dan plokis. Second of all bukannya lu sendiri yang encourage rakyat buat demo/unjuk rasa untuk nyampein aspirasi kita? Apa kita cuma boleh demo kalo pas presidennya bukan lu ndut? https://t.co/64OMyYMlpn,1961797374847902047,https://pbs.twimg.com/media/Gzm0Th_a0AAsjvK.jpg,,in,,1,1,47,https://x.com/undefined/status/1961797374847902047,1554798372120190976,
1961362752158769551,Fri Aug 29 09:38:15 +0000 2025,261,Sejumlah mahasiswa Universitas Indonesia berangkat menuju Polda Metro Jaya untuk menggelar unjuk rasa pada Jumat (29/8). Mereka rencananya akan bergabung dengan berbagai elemen masyarakat. Menurut koordinator aksi langkah ini merupakan bentuk kekecewaan mahasiswa terhadap https://t.co/74BgG8iqT4,1961362752158769551,https://pbs.twimg.com/amplify_video_thumb/1961362584747331585/img/8EeKd1aHrkdj87HM.jpg,,in,,2,6,73,https://x.com/undefined/status/1961362752158769551,71436318,
1960989736325308470,Thu Aug 28 08:56:01 +0000 2025,792,#Foto Massa mahasiswa menggelar demonstrasi di Gerbang Pancasila pintu belakang kompleks DPR. Mereka menuntut terkait kinerja dan gaji anggota DPR. &gt;&gt; https://t.co/gyL5LD1BZ6 Foto: Rifkianto Nugroho/detikcom https://t.co/Kt6mRaeJJr,1960989736325308470,https://pbs.twimg.com/media/GzbVk37aYAAO1lE.jpg,,in,,3,5,373,https://x.com/undefined/status/1960989736325308470,69183155,
1962147593603227875,Sun Aug 31 13:36:55 +0000 2025,376,Tuntutan ini akan di kejar oleh mahasiswa dan aksi demo berlanjut bila para ketua parpol tidak bisa ambil sikap maka ada tekakan masa yg ambil tindakan Kalo aye ( SETUJU ) https://t.co/TmeRGmNsK8,1962147593603227875,https://pbs.twimg.com/ext_tw_video_thumb/1962147182360031232/pu/img/m5mW_M7JFUk_jK7j.jpg,,in,,2,5,180,https://x.com/undefined/status/1962147593603227875,1154359993895751680,
1961237905088848365,Fri Aug 29 01:22:09 +0000 2025,3189,Pemicu terjadinya demo: - Eko Patrio - Uya Kuya - Sri Mulyani https://t.co/3c0A2DRGQ6,1961237905088848365,https://pbs.twimg.com/media/Gze3efhbkAAzYX4.jpg,,in,,13,66,629,https://x.com/undefined/status/1961237905088848365,194582998,
1959941061595333068,Mon Aug 25 11:28:57 +0000 2025,820,DARI SISI LAIN DEMO 25/8/2025 DEPAN DPR... MASSA AKSI MELAMPIASKAN KEKECEWAAN DAN KEMARAHAN PADA MOBIL YANG DIDUGA ANGGOTA DPR...‼️ #DesakPrabowoBubarkanDPR #DesakPrabowoBubarkanDPR 🆘🆗 https://t.co/Z9MPBan6ez,1959941061595333068,https://pbs.twimg.com/ext_tw_video_thumb/1959940939805507584/pu/img/0QmKrvIClmtHKOkW.jpg,,in,,14,81,310,https://x.com/undefined/status/1959941061595333068,1630749805734678529,
1961683518750437876,Sat Aug 30 06:52:51 +0000 2025,15,Aksi unjuk rasa pengemudi ojek online (ojol) di Jalan Kramat Kwitang Jakarta Pusat Sabtu (30/8/2025) sempat diwarnai momen unik. Di tengah ketegangan sejumlah warga berkerumun menyaksikan pertunjukan topeng monyet di jalanan yang masih dipenuhi puing batu dan sisa bakaran. https://t.co/srW2uom8Tc,1961683518750437876,https://pbs.twimg.com/amplify_video_thumb/1961683442758029312/img/xX4AKqh0JEKcxw0b.jpg,,in,,3,1,5,https://x.com/undefined/status/1961683518750437876,46693036,
1961042992598511704,Thu Aug 28 12:27:38 +0000 2025,665,Massa buruh menyampaikan 6 tuntutan dari Hapus Outsourcing dan Tolak Upah Murah hingga Redesain Sistem Pemilu 2029. Namun sejak siang tadi sebagian besar buruh yang turun ke jalan sejak pagi telah meninggalkan lokasi demonstrasi. Mahasiswa dan elemen masyarakat mengambil alih https://t.co/RArj4jiBWQ,1961042992598511704,https://pbs.twimg.com/amplify_video_thumb/1961042872536530944/img/P41CdUVjU5b52p4G.jpg,,in,,3,7,272,https://x.com/undefined/status/1961042992598511704,1158355819512991747,
1961839696390377522,Sat Aug 30 17:13:27 +0000 2025,259,YANG DEMO AKSI DI JOGJA PLS BE AWAREE! MEDIS JOGJA JUGA TOLONG DI PERHATIKAN KANAN KIRINYA YA. INDONESIA SUDAH TIDAK AMAN UNTUK MASYARAKAT (sumber dari teman kampusku) https://t.co/OVcSZZrJL8,1961839696390377522,https://pbs.twimg.com/media/GznazeLbcAA9rTa.jpg,,in,,8,2,109,https://x.com/undefined/status/1961839696390377522,1755810125594636288,
1960997547423695298,Thu Aug 28 09:27:03 +0000 2025,576,Rusuh demo depan Gedung DPR Kamis 28 Agustus 2025 Mahasiswa Vs keparat https://t.co/DEjctpa5Rf,1960997547423695298,https://pbs.twimg.com/ext_tw_video_thumb/1960997415227650048/pu/img/aBFAzoMDiXdzaCF3.jpg,,in,,9,13,238,https://x.com/undefined/status/1960997547423695298,929287558281830400,
1959835660417978406,Mon Aug 25 04:30:08 +0000 2025,661,Pengemudi ojek online (ojol) yang mengikuti demo 25 Agustus 2025 meminta para anggota DPR RI memperhatikan nasib rakyat dibandingkan kepentingan peribadinya sendiri. Baca selengkapnya https://t.co/Qde67LAKmJ ~LL #Demo #DPR https://t.co/RTL6GKxHWp,1959835660417978406,https://pbs.twimg.com/media/GzK8GWKagAAGDi3.jpg,,in,,5,7,176,https://x.com/undefined/status/1959835660417978406,23343960,
1960973497838264554,Thu Aug 28 07:51:29 +0000 2025,2539,Hari ini mahasiswa melakukan aksi demo lagi didepan gedung DPR RI Mereka melakukan aksi damai dan tertib . Harusnya pejabat negara menemui mereka dnger aspirasi rakyat . Mereka uda melakukan aksi demokrasi tertib . Mana kata puan pintu DPR terbuka lebar ? Masih dikunci https://t.co/m3YNacxWO3,1960973497838264554,https://pbs.twimg.com/amplify_video_thumb/1960973187191332866/img/pQcSnMvnCChw8V6S.jpg,,in,,17,41,562,https://x.com/undefined/status/1960973497838264554,1219640316526907393,
1961386047994302510,Fri Aug 29 11:10:49 +0000 2025,310,GUYS DAPET UPDATE DEMO UNIV BANDUNG di depan posko medik kebakar dan udah mulai ricuh sampe pada kejar-kejaran mobil ambulans dihalangin tapi rumah dinas pemprov berhasil dibakar massa #BubarkanDPR #polisipembunuh #polisipembunuhrakyat #resetindonesia https://t.co/wclLLAgTiY,1961386047994302510,https://pbs.twimg.com/media/Gzg-L7KaIAA_eaG.jpg,,in,,4,6,161,https://x.com/undefined/status/1961386047994302510,1038285971639361536,
1961351559603728710,Fri Aug 29 08:53:46 +0000 2025,1319,Situasi terkini dari aksi Mahasiswa di depan Gedung DPRD. Gas air mata sudah mulai ditembakan https://t.co/MS07D3vqIW,1961351559603728710,https://pbs.twimg.com/amplify_video_thumb/1961351384030482432/img/o76LXgb69AgEFrE8.jpg,,in,,40,46,542,https://x.com/undefined/status/1961351559603728710,101494663,
1961381641252712920,Fri Aug 29 10:53:18 +0000 2025,565,teman teman !upi ataupun mahasiswa universitas yang lain yg ikut demo di bandung staysafe yaa :( udah ada beberapa korban mahasiswa yg lain udah kena akibat oknum-oknum polisi semangat terus ya! perjuangkan suara masyarakat indonesia! https://t.co/ALeMKw0j60,1961381641252712920,https://pbs.twimg.com/media/Gzg6NTvWgAAa9lf.jpg,,in,,13,7,116,https://x.com/undefined/status/1961381641252712920,1245981587423911937,
1961361497587884138,Fri Aug 29 09:33:16 +0000 2025,797,Dari depan gedung DPRD aksi Mahasiswa tidak mundur meskipun terus dihujani gas air mata. https://t.co/smWPwVTKwQ,1961361497587884138,https://pbs.twimg.com/amplify_video_thumb/1961361420140044288/img/MzqV-h69EtKGOPFC.jpg,,in,,18,9,324,https://x.com/undefined/status/1961361497587884138,101494663,
1961773118957187376,Sat Aug 30 17:39:53 +0000 2025,6938,@ramusfractus tolong buat temen temen semuanyaa stay safe yaaa gue baru dapet info dari sepupu gue dia mahasiswi UI. ada polisi yg nyamar di sekitaran stasiun/transum yg geledahin tas orang orang buat cari tau mereka mahasiswa yg baru pulang demo atau bukan ada jg yg ngikutin sampe kosan... https://t.co/KjuW5cP0Cm,1961846347809841212,https://pbs.twimg.com/media/Gzng2fba8AALKOY.jpg,ramusfractus,in,,210,49,1880,https://x.com/undefined/status/1961846347809841212,1076614968819118080,
1961842259823088063,Sat Aug 30 17:23:38 +0000 2025,454, BANTU SHARE RT dapat kabar dari adikku keparat udah mulai melakukan penculikan mahasiswa tolong banget untuk mahasiswa yang ikut demo maupun ga ikut demo segera pulang dan stay at home jangan keluar dulu https://t.co/N1ORMpGiX3,1961842259823088063,https://pbs.twimg.com/media/GzndI3oa8AAB5zc.jpg,,in,,3,4,192,https://x.com/undefined/status/1961842259823088063,1218366979297271808,
1961796212811587673,Sat Aug 30 14:20:40 +0000 2025,217,Ribuan massa masih melanjutkan aksi unjuk rasa di dekat Gedung Mako Brimob Kwitang sejak pukul 12 siang hingga malam ini Sabtu (30/8/2025). Mereka menuntut keadilan atas tewasnya pengemudi ojek online Affan Kurniawan yang terlindas mobil rantis Brimob serta pembebasan dua https://t.co/toSNYjWyzT,1961796212811587673,https://pbs.twimg.com/media/GzmzPZrXEAAdbvO.jpg,,in,,1,3,85,https://x.com/undefined/status/1961796212811587673,154102750,
1961655142312542370,Sat Aug 30 05:00:06 +0000 2025,10782,Gedung DPRD Kota Makassar terbakar dalam aksi unjuk rasa pada Jumat (29/08). Abay pegawai DPRD Kota Makassar menjadi salah satu dari tiga korban yang wafat. Abay merupakan fotografer DPRD. Almarhum Abay wafat karena terjebak dalam peristiwa tersebut. Dalam snapgram terakhirnya https://t.co/7oFa7TuR1O,1961655142312542370,https://pbs.twimg.com/media/Gzky81ebkAEqN02.jpg,,in,,88,195,1147,https://x.com/undefined/status/1961655142312542370,1172167188800655360,
1961581165279908324,Sat Aug 30 00:06:08 +0000 2025,1573,Konfirmasi dari Ejen Budi soal pemukulan mahasiswa oleh intelkam kroco masih gamang antara tugas atau desersi Himbauan saya masih sama ke Polri: bubarkan diri ketika ketemu massa aksi jaga rumah sakit saja https://t.co/FZGAo8cJsV,1961581165279908324,https://pbs.twimg.com/media/GzjvrGHbkAEb_TK.jpg,,in,,91,33,1126,https://x.com/undefined/status/1961581165279908324,1794298849651212288,
1961056865242263765,Thu Aug 28 13:22:46 +0000 2025,952,Situasi terkini semakin ricuh dan memanas aksi demo di Gedung DPR #Mahasiswa #MahasiswaBergerak https://t.co/LJUMTO38zj,1961056865242263765,https://pbs.twimg.com/amplify_video_thumb/1961056652309987328/img/mC5j63XEmicQfh-t.jpg,,in,,6,13,306,https://x.com/undefined/status/1961056865242263765,1159475566069731331,
1961954989183791437,Sun Aug 31 00:51:35 +0000 2025,1245,Gelombang kericuhan aksi unjuk rasa di Jakarta kian meluas. Pada Minggu 31 Agustus 2025 dini hari sekelompok massa dilaporkan menyerbu sebuah rumah yang diduga milik Menteri Keuangan Sri Mulyani di kawasan Bintaro Jakarta Selatan. Peristiwa tersebut terungkap dari unggahan https://t.co/ZJDr9bYlB7,1961954989183791437,https://pbs.twimg.com/amplify_video_thumb/1961954596945035264/img/ZKR7coxBuA6UjPxD.jpg,,in,,23,55,392,https://x.com/undefined/status/1961954989183791437,58880688,
1961689640064438534,Sat Aug 30 07:17:11 +0000 2025,2025,Ini baru Beneran DEMO aksi damai mahasiswa UI dan BEM SI . Mereka tidak merusak fasilitas umum dan tidak melakukan penjarahan di kwitang atau di Polres . Ini bneran sebagai wakil suara rakyat yg menyampaikan aspirasi harusnya DPR menemui mahasiswa biar demo ini ada endingny https://t.co/ZSpFddhC5W,1961689640064438534,https://pbs.twimg.com/amplify_video_thumb/1961689512519897088/img/3nLhO0f6rwvS067e.jpg,,in,,20,30,420,https://x.com/undefined/status/1961689640064438534,1219640316526907393,
1960994969944309817,Thu Aug 28 09:16:49 +0000 2025,529,Buruh Injak-injak Spanduk Bergambar Zulkifli Hasan dan Eko Patrio saat Demo di Depan Gedung DPR Sumber yt Tribunnews https://t.co/CFWnPigKRO,1960994969944309817,https://pbs.twimg.com/ext_tw_video_thumb/1960994594289836033/pu/img/ZSlCzLUG6MJ6tL74.jpg,,in,,7,24,158,https://x.com/undefined/status/1960994969944309817,1424513138209157121,
1962014967722549339,Sun Aug 31 04:49:55 +0000 2025,14,Kondisi Pos Polisi di Bundaran Patung Pemuda Jakarta yang terbakar pasca terjadinya aksi unjuk rasa Minggu (31/8) siang. Krs #BeritaElshinta #KitaJagaIndonesia #JagaIndonesia https://t.co/I9M7nrF9SV,1962014967722549339,https://pbs.twimg.com/amplify_video_thumb/1962014822213861376/img/-Yc1IkSuGECmmcwP.jpg,,in,,0,0,5,https://x.com/undefined/status/1962014967722549339,121640063,
1962019151066845246,Sun Aug 31 05:06:32 +0000 2025,97,This is me too dulu. Mungkin semua orang juga pernah di fase ini. Tapi we have to changed. Dan semakin belajar semakin paham kalau 'Demo' atau 'Unjuk Rasa' memang layak untuk dilakukan sebagai bentuk kebebasan berekspresi.,1962019151066845246,,,in,,1,0,17,https://x.com/undefined/status/1962019151066845246,777051542469775360,
1959988243900113246,Mon Aug 25 14:36:26 +0000 2025,1047,Hari ini ada aksi organik di Jakarta yang dimulai melalui platform X dan lain-lain. Tindakan yang menuntut dibubarkannya DPR atau Pemerintah Indonesia mendapat respon luar biasa khususnya dari masyarakat dan siswa SMA. Ini juga merupakan pukulan berat bagi semua mahasiswa yang https://t.co/XzCHij8Qe7,1959988243900113246,https://pbs.twimg.com/ext_tw_video_thumb/1959988113964777472/pu/img/0P6rBglyDV1sd5fg.jpg,,in,,9,40,260,https://x.com/undefined/status/1959988243900113246,117694469,
1961035985409524155,Thu Aug 28 11:59:47 +0000 2025,392,DEMO 28/8/2025 RICUH... BENTROKAN PANAS DI ATAS REL MASSA VS POLISI DENGAN MOLOTOF DAN PETASAN...‼️ #RektorUGMPenjualIjazah #RektorUGMPenjualIjazah 🆘🆗 https://t.co/EeQvy4GWNs,1961035985409524155,https://pbs.twimg.com/ext_tw_video_thumb/1961035899665543168/pu/img/jdE5M96UO_f78_b3.jpg,,in,,3,16,171,https://x.com/undefined/status/1961035985409524155,1630749805734678529,
1961250528295583792,Fri Aug 29 02:12:18 +0000 2025,314,Selamat pagi dan selamat beraktivitas. untuk teman teman mahasiswa yang hari ini mau demo untuk menyuarakan aspirasi nya. semangat untuk perjuangan nya dan hati hati jaga diri kalian. MERDEKA.....!!!!!!,1961250528295583792,,,in,,3,2,47,https://x.com/undefined/status/1961250528295583792,1827886133382115329,
1961691573915410516,Sat Aug 30 07:24:52 +0000 2025,17,Panglima Kostrad (Pangkostrad) Letnan Jenderal TNI Mohammad Fadjar MPICT. turun langsung meninjau aksi unjuk rasa yang masih berlangsung hingga hari ini Sabtu (30/8/2025) di depan Mako Brimob Kwitang Jakarta Pusat. https://t.co/V6fSH3L5Ij,1961691573915410516,https://pbs.twimg.com/media/GzlUFb4boAAwosJ.jpg,,in,,0,7,5,https://x.com/undefined/status/1961691573915410516,702207679,
1961982201337389300,Sun Aug 31 02:39:43 +0000 2025,34,Tuh gw kaga bohong cuy mereka ingin teman2nya di bebaskan BEM SI juga pas demo di polda minta massa aksi unjuk rasa yg ditangkap dibebaskan. Bakal tambah memanas cuy klo gk dibebasin. https://t.co/D4MJfnobDa,1961982201337389300,https://pbs.twimg.com/media/GzpcagmagAAk59X.jpg,,in,,0,2,1,https://x.com/undefined/status/1961982201337389300,1594274770568482816,
1961348954169184727,Fri Aug 29 08:43:25 +0000 2025,23384,INGAT GUYS INI DEMO BUKAN BALIK KE PENJARAHAN LAGI YA KALO ADA YANG NGEJARAH BISA JADI ITU PROVOKATOR ATAU ORANG YANG AMBIL KESEMPATAN KALO LIAT ADA YANG JARAH TABOK AJA KALIAN JANGAN BIKIN 98 PART 2 LINDUNGI MINORITAS PEREMPUAN ANAK2 DISABILITAS,1961348954169184727,,,in,,145,55,16571,https://x.com/undefined/status/1961348954169184727,248942124,
1961584674850975876,Sat Aug 30 00:37:31 +0000 2025,4304,@tanyarlfes Demo serentak seluruh indonesia 2019 tentang uu cipta kerja jga chaos nder hanya saja cepat dikendalikan krn dulu langsung dikepung gedung DPR sama mahasiswa thn ini keliatan chaos banget krn demonya hampir tiap bln ada tpi tdk prnh didengar dan terpecah belah,1961589061577289938,,tanyarlfes,in,,6,9,315,https://x.com/undefined/status/1961589061577289938,1647858726509084673,
1962040694924857732,Sun Aug 31 06:32:09 +0000 2025,10,Sebanyak 138 demonstran ditangkap pihak Kepolisian Daerah Bali dalam aksi unjuk rasa di depan Kantor DPRD Bali Renon Denpasar. Kepala Bidang Hubungan Masyarakat Polda Bali Komisaris Besar Polisi Ariasandy di Denpasar Minggu mengatakan ratusan orang tersebut karena dianggap https://t.co/dySje9xF6I,1962040694924857732,https://pbs.twimg.com/media/GzqRm9vaAAAyIvo.jpg,,in,,0,1,8,https://x.com/undefined/status/1962040694924857732,18071520,
1961966318296629641,Sun Aug 31 01:36:36 +0000 2025,29,Ketua DPR RI Puan Maharani bersama Fraksi PDI Perjuangan DPR RI melayat ke rumah duka Affan Kurniawan pengemudi ojek online yang tewas dilindas mobil rantis Brimob saat aksi unjuk rasa di Jakarta. https://t.co/xrab9RhcQx,1961966318296629641,https://pbs.twimg.com/amplify_video_thumb/1961965851059634176/img/b4sT_e2ulJTyVzYy.jpg,,in,,0,9,5,https://x.com/undefined/status/1961966318296629641,153407983,
1962048131543273860,Sun Aug 31 07:01:42 +0000 2025,6,Gelombang unjuk rasa #BubarkanDPR telah berlangsung lebih dari 48 jam sejak 28 Agustus 2025 menyebar dari Jakarta ke kota-kota besar seperti Medan Makassar dan Surabaya. Aksi spontan mahasiswa buruh pelajar hingga pengemudi ojek online itu dilatarbelakangi tunjangan https://t.co/dUm6CJuAyJ,1962048131543273860,https://pbs.twimg.com/media/GzqYXyAawAArvav.jpg,,in,,0,1,5,https://x.com/undefined/status/1962048131543273860,124390203,
1962049143557537967,Sun Aug 31 07:05:43 +0000 2025,5,Gubernur Jawa Barat Dedi Mulyadi angkat bicara soal kericuhan dalam aksi unjuk rasa di Kota Bandung pada Jumat malam (29/8/2025). Ia menegaskan penyampaian aspirasi seharusnya dilakukan dengan damai tanpa harus merusak fasilitas umum. Simak berita selengkapnya hanya di https://t.co/cymBB7NsnY,1962049143557537967,https://pbs.twimg.com/amplify_video_thumb/1962048153525575680/img/alnqqvK40j0E0eGX.jpg,,in,,0,3,2,https://x.com/undefined/status/1962049143557537967,55507370,
1961206165716832510,Fri Aug 29 03:53:21 +0000 2025,275,@msaid_didu siapa aja boleh unjuk rasa ga harus pelajar / mahasiswa. mau mahasiswa pekerja ojol petani pedagang guru asn swasta. semua berhak ikut demo. itu diatur di UU bahwa semua orang bebas berpendapat. yang jadi pertanyaan kenapa aparat gabisa menjaga keamanan dan malah anarkis?,1961275957081190776,,msaid_didu,in,,1,3,29,https://x.com/undefined/status/1961275957081190776,1307081168173625344,
1961427516578828774,Fri Aug 29 13:55:36 +0000 2025,393,Aksi demonstrasi mahasiswa masih berlangsung di depan Polda Metro Jaya hingga sore tadi. Berdasarkan pantauan @RT_com mereka membawa bendera BEM universitas serta memakai almamater dari universitas masing-masing. https://t.co/furnuwVkQl,1961427516578828774,https://pbs.twimg.com/amplify_video_thumb/1961426993482010625/img/VPEPZ_DRVGh01eiR.jpg,,in,,1,2,59,https://x.com/undefined/status/1961427516578828774,53859736,
1961726605623222695,Sat Aug 30 09:44:04 +0000 2025,2,Jumat 29 Agustus 2025 Polrestabes Medan melaksanakan Pengamanan Aksi Unjuk Rasa di depan Kantor DPRD Sumatera Utara. Terimakasih Kepada Seluruh Mahasiswa dan Ojol atas Aksi Damai dalam Menyampaikan Aspirasi. #polriuntukmasyarakat #untungadapolisi #unjukrasadamai https://t.co/8S8zd1THg8,1961726605623222695,https://pbs.twimg.com/amplify_video_thumb/1961726257554767872/img/wFhlRQMQKYi15Hus.jpg,,in,,0,0,1,https://x.com/undefined/status/1961726605623222695,1930178760504160257,
1961772550280888475,Sat Aug 30 12:46:38 +0000 2025,18,Aksi Humanis ditunjukkan Personel Polda Jatim dalam mengamankan Unjuk Rasa Aliansi BEM Surabaya (ABS) BEM SI Jawa Timur dan BEM Nusantara Jawa Timur di depan Mapolda Jatim pada hari Sabtu 30 Agustus 2025. https://t.co/9WUXRuIyne,1961772550280888475,https://pbs.twimg.com/ext_tw_video_thumb/1961772410954510336/pu/img/PCVMKm1buoaKllsA.jpg,,in,,0,2,6,https://x.com/undefined/status/1961772550280888475,947181899633516545,
1961776124465406294,Sat Aug 30 13:00:50 +0000 2025,149,Aksi unjuk rasa di sekitar Markas Komando (Mako) Brimob Kwitang Jakarta Pusat dilaporkan masih terus berlangsung. Hingga Sabtu 30 Agustus 2025 suasana di lokasi masih dipenuhi oleh massa aksi. Sekitar pukul 18.30 WIB situasi mulai memanas saat sejumlah massa terlihat https://t.co/TstDS85GJ9,1961776124465406294,https://pbs.twimg.com/amplify_video_thumb/1961775203824070657/img/LUyft-0uoHyWdzH8.jpg,,in,,2,16,37,https://x.com/undefined/status/1961776124465406294,57261519,
1961985631015547344,Sun Aug 31 02:53:21 +0000 2025,7,Gedung DPRD Kabupaten Cianjur Jawa Barat terlihat rusak parah pada sejumlah bagian bangunan pasca aksi unjuk rasa yang berakhir ricuh. Sejumlah pegawai dan staff tampak sedang membersihkan material sisa aksi Minggu (31/8). Anp #BeritaElshinta #KitaJagaIndonesia https://t.co/pDxBYqZ9Vv,1961985631015547344,https://pbs.twimg.com/amplify_video_thumb/1961985468255674368/img/TSeFva4xyNRaCyqo.jpg,,in,,0,0,4,https://x.com/undefined/status/1961985631015547344,121640063,
1962093718049321333,Sun Aug 31 10:02:50 +0000 2025,2,Kapolres Situbondo AKBP Rezi Dharmawan S.I.K. M.I.K. menerima aspirasi mahasiswa PMII dan GMNI Situbondo menggelar aksi unjuk rasa di depan Mapolres Situbondo dilanjutkan dengan tahlil bersama @bidhumas_jatim @DivHumas_Polri https://t.co/qxosovx5Sn,1962093718049321333,https://pbs.twimg.com/ext_tw_video_thumb/1962093608666099712/pu/img/5TGu5_C_mBLsPn4W.jpg,,in,,1,2,1,https://x.com/undefined/status/1962093718049321333,218735896,
1961961320556970187,Sun Aug 31 01:16:44 +0000 2025,426,Melihat Caranya Sudah Terlatih Ini Orang.. Niatnya memang membak4r.. Kalau massa biasa pasti dihancurin dan dicoret dulu.. Agendanya apa dan siapa ini?! Mahasiswa dah ga demo tapi demo tetap massif kayak pakai sif2an.. https://t.co/AlkdQI6RMu,1961961320556970187,https://pbs.twimg.com/ext_tw_video_thumb/1961961282359508993/pu/img/eX3IvjETIyfwcAle.jpg,,in,,3,20,219,https://x.com/undefined/status/1961961320556970187,214159664,
1962049845923127543,Sun Aug 31 07:08:31 +0000 2025,70,Kunjungan kerja (kunker) Komisi XI DPR RI ke Australia menuai kritik tajam publik. Pasalnya agenda tersebut berlangsung di tengah gelombang aksi unjuk rasa besar-besaran menolak kenaikan tunjangan DPR sekaligus disebut berbarengan dengan gelaran Sydney Marathon 2025. Ketua https://t.co/SCUQEbpIdf,1962049845923127543,https://pbs.twimg.com/ext_tw_video_thumb/1962049806765109248/pu/img/6PQVkpGNpNNvkwax.jpg,,in,,1,5,23,https://x.com/undefined/status/1962049845923127543,1282751327588585473,
1960964333174972745,Thu Aug 28 07:15:04 +0000 2025,421,Massa Demo Buruh Meluapkan kekecewaan injak-injak spanduk bergambar Eko Patrio dan @ZUL_Hasan https://t.co/y5yLJ21VgR,1960964333174972745,https://pbs.twimg.com/ext_tw_video_thumb/1960964259615268869/pu/img/-niXqG9CriwNVDj3.jpg,,in,,2,9,170,https://x.com/undefined/status/1960964333174972745,1456283686312103939,
1962057575228403962,Sun Aug 31 07:39:13 +0000 2025,162,Pemprov DKI Jakarta melalui Dinas Tenaga Kerja Transmigrasi dan Energi (Disnakertransgi) mengimbau perusahaan di ibu kota untuk menerapkan kebijakan work from home (WFH) pada Senin (1/9). Imbauan ini dikeluarkan menyusul adanya aksi unjuk rasa yang berpotensi mengganggu https://t.co/V09sk1Qtvh,1962057575228403962,https://pbs.twimg.com/media/Gzqg5iraAAEGY3m.jpg,,in,,14,1,79,https://x.com/undefined/status/1962057575228403962,759692754985242625,
1961799960124653773,Sat Aug 30 14:35:33 +0000 2025,38,[Rakyat Lelah Direpresi Sontak Unjuk Rasa ke Polisi] Ratusan mahasiswa yang dipimpin oleh Atan Ketua BEM Kuning UI memulai Aksi Aparat Keparat dari Lapangan FISIP (Lapfis) hingga Polda Metro Jaya pada Jumat (29/8). https://t.co/I0qRdFMein,1961799960124653773,https://pbs.twimg.com/media/Gzm2qPGaMAEP1pm.jpg,,in,,3,1,14,https://x.com/undefined/status/1961799960124653773,130211143,
