"conversation_id_str","created_at","favorite_count","full_text","id_str","image_url","in_reply_to_screen_name","lang","location","quote_count","reply_count","retweet_count","tweet_url","user_id_str","username"
"1961727037573620017","Sat Aug 30 09:53:56 +0000 2025","783","@SelebtwitMobil Untuk meluruskan kronologi pengemudi nerobos barikade dari senayan yg sudah terfokus untuk demo berkali2 gamau nurut dan ngebut. Kondisi BEM SI dll masih banyak dan pengemudi ga mengindahkan larangan dari mereka untuk menghindari kerugian","1961729086415605782","","SelebtwitMobil","in","","10","30","147","https://x.com/undefined/status/1961729086415605782","1399025345546768384",
"1959960635401265301","Mon Aug 25 12:46:44 +0000 2025","417","Piye Media? Enak toh jaman prabowo. Bebas siaran langsung meliput demo dari awal sampai selesai. Jaman mulyono mana bisa lu se bebas itu ","1959960635401265301","","","in","","1","14","103","https://x.com/undefined/status/1959960635401265301","1270980383761330176",
"1959966368788578347","Mon Aug 25 13:09:31 +0000 2025","581","Kejanggalan kejamggalan demo hari ini: 1. Belum apa2 sudah bentrok 2. Pendemo gahar vs polisi lemah lembut 3. Tidak kelihatan brimob berseragam hitam yg biasanya paling depan dan garang 4. CNN meliput kredit @Tan_Mar3M 5. Boleh dibilang gak ada orasi 6. Penutupan jalan","1959966368788578347","","","in","","15","57","244","https://x.com/undefined/status/1959966368788578347","486650220",
"1962302700844159095","Sun Aug 31 23:53:16 +0000 2025","3","Berita demo rakyat vs pejabat udah sampe luar negeri emang presiden ga malu ya ? Disaat yg lain perang lawan antar negara indo perang lawan pemerintahnya sendiri. Maluuu IHH apa kata dunia bruhh demi mempertahankan jabatan sampe pertumpahan darah ","1962302700844159095","","","in","","0","0","1","https://x.com/undefined/status/1962302700844159095","1707424175919648768",
"1962196382506520614","Sun Aug 31 16:50:48 +0000 2025","0","Mungkin Prabowo akan berhasil menekan demo kali ini. Dengan kekerasan tentunya. Tapi tidak dengan amarah rakyat. Amarah akan semakin padat dan menumpuk hingga suatu saat datang pemicu lain yang akan meledak lebih dahsyat.","1962196382506520614","","","in","","0","6","0","https://x.com/undefined/status/1962196382506520614","49309210",
"1962140220767531294","Sun Aug 31 13:07:38 +0000 2025","0","Presiden Prabowo Sebut Ada Upaya Makar di Balik Aksi Demonstrasi https://t.co/aXAGRJK1K9","1962140220767531294","","","in","","0","0","0","https://x.com/undefined/status/1962140220767531294","1857478545024626690",
"1962255417037430798","Sun Aug 31 20:45:23 +0000 2025","2","lucunya lagi ada yg not even privileged enough tapi kasian sama presiden.. salahin rakyat yang demo.. sampe yang belain polisi pun ada","1962255417037430798","","","in","","0","0","0","https://x.com/undefined/status/1962255417037430798","1130104920797900802",
"1962209061539352876","Sun Aug 31 17:41:11 +0000 2025","8","the gen z-est things i saw in internet these days: - prabowo di tarot-in - ngevlog ikut demo pertama kali - demo di roblox - lari pace 2 karena dikejar cops (masih sempet nyalain strava) - ngelus paha cops yg naik kuda","1962209061539352876","","","in","","0","0","0","https://x.com/undefined/status/1962209061539352876","1917599350236352512",
"1962288778346905799","Sun Aug 31 23:11:14 +0000 2025","0","@lovvack Berdasarkan info terkini (31 Agustus 2025) dari sumber seperti Kompas dan Tempo situasi di Jakarta relatif kondusif setelah presiden cabut tunjangan DPR dengan lalu lintas lancar di banyak area. Namun ada laporan demo sporadis di sekitar DPR dan kemungkinan kerusuhan. Kalau","1962292123342188638","","lovvack","in","","0","0","0","https://x.com/undefined/status/1962292123342188638","1720665183188922368",
"1962161181499797629","Sun Aug 31 14:30:55 +0000 2025","2","Demo didalangi asing krn ricuh prabowO bongkar megakorupsi????? dumbest shit I've ever read these 2 days. Skala korup indon nih udah quadriliun kurang mega???? BISA STOP HALU GAK? GA ADA ASING INI TUH RAKYAT NUNTUT. KALO SKIZO KE PSIKIATER ANJEEEENG JGN JADI PRESIDEN.","1962161181499797629","","","in","","0","0","0","https://x.com/undefined/status/1962161181499797629","191145970",
"1961932933591433404","Sat Aug 30 23:23:56 +0000 2025","735","Makin aneh demo berubah jadi penjarahan . Terstruktur sekali.. Prabowo masih mikirin tindak tegas pendemo anarkis. Payah @prabowo","1961932933591433404","","","in","","5","67","245","https://x.com/undefined/status/1961932933591433404","1182582278",
